{
  "formatVersion": 1,
  "locale": "pt-BR",
  "displayName": "Português (Brasil)",
  "sourceRevision": "sha256:57bf2bcfdb0208d6dcbc61aecd07fe0f7e1aee23977825695382bc1f07975921",
  "entries": {
    "settings.appearance.language.title": {
      "sourceHash": "sha256:e7db5ad0c66e83fe12e55f347d86a2b7a6dd612ba1e4cd291fd1968b1562e52a",
      "value": "Idioma"
    }
  }
}
